{
  "reference": "upstream/main",
  "candidate": "HEAD",
  "issues": {
    "author": "amcasey",
    "min_number": 3461,
    "include": [3440]
  },
  "exclusions": [
    {
      "match": "*EkeraHastadFactoring*",
      "reason": "Slow; excluded from this review"
    }
  ],
  "report": ".work/review.md"
}
